{
  "provider_revision_id": "provider-revision-coding-shell-terminal-connect-v1",
  "api_version": "v1",
  "capabilities": [
    {
      "id": "sandbox.exec",
      "versions": ["1.0.0"],
      "profiles": ["exec-v1"]
    },
    {
      "id": "sandbox.terminal",
      "versions": ["1.0.0"],
      "profiles": ["terminal-v1"]
    },
    {
      "id": "sandbox.terminal-connect",
      "versions": ["1.0.0"],
      "profiles": ["terminal-connect-v1"]
    }
  ],
  "runtime_profiles": [
    {
      "id": "sandbox-runtime-coding-shell-v1",
      "isolation_class": "container",
      "runtime_class_name": "sandbox-runtime-coding-shell",
      "architecture": ["amd64"],
      "capability_profile_ids": ["exec-v1", "terminal-v1", "terminal-connect-v1"]
    }
  ],
  "snapshot_restore_profiles": [
    {
      "profile_id": "sandbox-snapshot-workspace-v1",
      "level": "workspace",
      "suite_id": "sandbox-provider",
      "suite_version": "1.0.0",
      "suite_digest": "sha256:78e01cc5eb176083896baf8507c551d2ee88e56b93197321702748a88949e89d"
    }
  ],
  "limits": {
    "max_cpu_millis": 1000,
    "max_memory_bytes": 1073741824,
    "max_ephemeral_storage_bytes": 1073741824,
    "max_workspace_bytes": 1073741824,
    "max_lease_seconds": 3600,
    "max_exec_seconds": 300
  }
}
